resource-date,entry-date,organisation,site,site-address,site-plan-url,deliverable,ownership,planning-permission-status,planning-permission-type,hazardous-substances,latitude,longitude,hectares,minimum-net-dwellings,maximum-net-dwellings,start-date,end-date,notes,resource,name
2019-12-19,2019-12-09,local-authority-eng:CAT,BR-107,"Marsh House, St Peter's Road, Whitstable, CT5 1SU","https://mapping.canterbury.gov.uk/webapps/Brownfield_Sites/?center=610857,166821,27700&scale=500",yes,,permissioned,full planning permission,,51.361309,1.027408,0.02,4,4,2019-11-01,,"Proposed three-storey extension to front and side, demolition of existing garages and construction of two-storey extension to form 7 no. additional flats, with associated parking.",da787466995e063f8e2c510c82b805cd1e28e229227540cc63287abe00bd2a18,Canterbury City Council
2019-12-19,2019-12-09,local-authority-eng:CAT,BR-109,"Highstead Riding School, Highstead, Chislet, CT3 4LX","https://mapping.canterbury.gov.uk/webapps/Brownfield_Sites/?center=621384,166276,27700&scale=1000",yes,,permissioned,full planning permission,,51.352415,1.178034,0.4,2,2,2019-11-01,,Proposed erection of 2no. two-storey detached dwellings with associated parking following demolition of former riding school and ancillary buildings.,da787466995e063f8e2c510c82b805cd1e28e229227540cc63287abe00bd2a18,Canterbury City Council
2019-12-19,2019-12-09,local-authority-eng:CAT,BR-110,"2-2A Ethelbert Road, Canterbury, CT1 3NE","https://mapping.canterbury.gov.uk/webapps/Brownfield_Sites/?center=615501,156935,27700&scale=500",yes,,permissioned,full planning permission,,51.270805,1.088041,0.06,3,3,2019-11-01,,Proposed part 3 and part 4 storey building comprising 10 no. flats with associated parking and external works following demolition of properties.,da787466995e063f8e2c510c82b805cd1e28e229227540cc63287abe00bd2a18,Canterbury City Council
2019-12-19,2019-12-09,local-authority-eng:CAT,BR-111,"Parham Student Village: 8-13 Albert Mews, 105 Sturry Road, 1-4 Riverdale House, Sturry Road, 1-3 Parham Close, Parham Road, 1-12 Becket Mews, Parham Close","https://mapping.canterbury.gov.uk/webapps/Brownfield_Sites/?center=615802,158872,27700&scale=1000",yes,,permissioned,full planning permission,,51.288083,1.093518,0.4,0,36,2019-11-01,,"Change of use from existing student accommodation at 8-13 Albert Mews, 105 Sturry Road, Canterbury to C3 residential dwellings; change of use from existing student accommodation at 1-4 Riverdale House, Sturry Road, Canterbury to C3 residential dwellings; change of use from existing student accommodation at 1-3 Parham Close, Parham Road, Canterbury to C3 residential dwellings with alterations to convert two end terrace properties into 2 no. one-bedroom and 2 no. two-bedroom flats including new and amended door openings; and change of use from existing student accommodation at 1-12 Becket Mews, Parham Close to C3 residential dwellings.",da787466995e063f8e2c510c82b805cd1e28e229227540cc63287abe00bd2a18,Canterbury City Council
2019-12-19,2019-12-09,local-authority-eng:CAT,BR-112,"Land at Ladesfield, Vulcan Close, Whitstable, CT5 4LZ","https://mapping.canterbury.gov.uk/webapps/Brownfield_Sites/?center=610292,165440,27700&scale=1000",yes,,permissioned,outline planning permission,,51.349118,1.018488,0.6,14,14,2019-11-01,,Outline application for proposed 14 no. dwellings with all matters reserved except access.,da787466995e063f8e2c510c82b805cd1e28e229227540cc63287abe00bd2a18,Canterbury City Council
2019-12-19,2019-12-09,local-authority-eng:CAT,BR-113,"41-45 Northgate, Canterbury, CT1 1BE","https://mapping.canterbury.gov.uk/webapps/Brownfield_Sites/?center=615244,158335,27700&scale=500",yes,,permissioned,full planning permission,,51.283472,1.085205,0.08,9,9,2019-11-01,,"Proposed 10 no. almshouse flats above 5 no. commercial units, following demolition of existing buildings at 41, 42 and 43-45 Northgate.",da787466995e063f8e2c510c82b805cd1e28e229227540cc63287abe00bd2a18,Canterbury City Council
